"Code","Waarde","DatumVanaf","DatumTot","Toelichting"
"1","Attendering CRL vermelding","2011-01-01",,"Inschrijvingsmededeling: het voor de digitale handtekening gebruikte certificaat staat vermeld op de certificaten revocatielijst van de certificaat autoriteit."
"2","Attendering op niet-inschrijving","2011-01-01",,"Inschrijvingsmededeling: het ter inschrijving aangeboden stuk voldoet niet aan de inschrijvingsvereisten."
"3","Verzoek tot verbetering","2011-01-01",,"Kadastermededeling: voor de bijwerking van de BRK is verbetering van het ingeschreven stuk nodig."
"4","Rectificatie verzoek","2011-01-01","2018-10-01","Kadastermededeling: na de verwerking van het stuk in de Basisregistratie Kadaster (AKR) is geconstateerd dat voor de bijwerking van die Basisregistratie Kadaster verbetering van het stuk nodig is."
"5","Herstel ten onrechte ingeschreven stuk","2018-07-01",,"Inschrijvingsmededeling: achteraf wordt geconstateerd dat het stuk niet voldeed aan de inschrijvingsvereisten en onterecht ingeschreven is."
"6","Bericht van weigering","2018-07-01",,"Inschrijvingsmededeling: het ter inschrijving aangeboden stuk waarvoor een attendering op niet-inschrijving verstuurd is, is niet ingetrokken en wordt formeel geweigerd."
"7","Verzoek tot verbetering achteraf","2018-10-01",,"Kadastermededeling: voor de bijwerking van de BRK is verbetering van het ingeschreven stuk nodig (oorzaak landmeetkundig)"
"8","Verzoek tot verbetering registratie","2020-03-01",,"Kadastermededeling: voor de bijwerking van de BRK is verbetering van het ingeschreven stuk nodig (oorzaak registratief)"
